機構名稱,縣市,縣市代碼,行政區,行政區代碼,地址全址,經度,緯度,特約服務項目,機構電話,電子郵件,機構負責人姓名,最後異動時間
臺北市政府社會局委託財團法人台灣省私立健順養護中心經營管理南港社區式長照機構,臺北市,63000,南港區,63000090,臺北市南港區重陽里重陽路187巷5號,121.5987625,25.05712891,日間照顧服務,02-26535311,nkelder@gmail.com,黃禎祥,20210226 17:22:27
臺北市私立康健居家式長照機構,臺北市,63000,內湖區,63000100,臺北市內湖區寶湖里民權東路6段180巷6號11F之19,121.5926514,25.06819534,喘息服務,02-87919104,kjcare.tw@gmail.com,吳姁媛,20221229 23:02:51
財團法人弘道老人福利基金會附設臺北市私立西松社區長照機構,臺北市,63000,松山區,63000010,臺北市松山區東榮里南京東路五段251巷46弄5號,121.5646896,25.05332184,小規模多機能服務,02-27616300,laughing@hondao.org.tw,王乃弘,20220209 09:54:07
財團法人台北市私立愛愛院,臺北市,63000,萬華區,63000070,臺北市萬華區大理街175巷27號,121.4955292,25.03455925,喘息服務,02-23060493,csp1@aiai.org.tw,施武靖,20221229 21:45:37
財團法人弘道老人福利基金會附設臺北市私立西松社區長照機構,臺北市,63000,松山區,63000010,臺北市松山區東榮里南京東路五段251巷46弄5號,121.5646896,25.05332184,營養餐飲服務,02-27616300,laughing@hondao.org.tw,王乃弘,20210303 16:55:50
臺北市政府社會局委託中華民國紅十字會台灣省分會經營管理臺北市中正社區長照機構,臺北市,63000,中正區,63000050,臺北市中正區建國里貴陽街一段60號3樓,121.5090408,25.03892517,營養餐飲服務,02-23831958,rct03702883@gmail.com,董光式,20210303 17:34:31
財團法人一粒麥子社會福利慈善事業基金會(嶺腳里)(社照C),新北市,65000,新店區,65000060,新北市新店區民權路42巷59弄12號5樓,121.5378189,24.9811306,巷弄長照站,02-89117897 #12、#15,W104116@wheat.org.tw,呂信雄,20230530 16:54:07
適群診所,臺北市,63000,大安區,63000030,臺北市大安區四維路198巷32號,121.5458679,25.02661896,居家失能個案家庭醫師照護服務,02-27063700,mollylin2886@gmail.com,蔡函衿,20221230 22:05:53
臺北市立聯合醫院附設仁愛護理之家,臺北市,63000,大安區,63000030,臺北市大安區仁愛路四段10號南棟4樓,121.5453033,25.03754044,日間照顧服務,"02-27093600 分機1520, 1521",B0076@tpech.gov.tw,方志嘉,20210305 13:49:46
臺北市政府社會局委託財團法人台北市立心慈善基金會經營管理臺北市萬華龍山社區長照機構,臺北市,63000,萬華區,63000070,臺北市萬華區青山里梧州街36號3樓之1,121.4974899,25.03737259,日間照顧服務,02-23361881,longshanold@gmail.com,洪金桐,20210305 14:32:02
栢麗恆全人診所,臺北市,63000,信義區,63000020,臺北市信義區忠孝東路五段431號2樓,121.5756073,25.04101372,居家失能個案家庭醫師照護服務,02-2765-7065,ymyhl2@gmail.com,葉恒良,20221230 22:07:19
芊潁顧問有限公司附設臺北市私立芊潁居家長照機構,臺北市,63000,中山區,63000040,臺北市中山區行政里建國北路3段94號2樓(D201室),121.5344696,25.06668282,喘息服務,02-2508-0383,qianyingoffice@gmail.com,何冠潁,20221229 23:18:22
泉益居家有限公司附設臺北市私立泉益居家長照機構,臺北市,63000,文山區,63000080,臺北市文山區忠順街一段20號1樓,121.5587769,24.98389626,喘息服務,02-86618880,chuanyi10910@gmail.com,詹弘毅,20221229 22:14:27
臺北市政府社會局委託中華民國紅十字會台灣省分會經營管理臺北市中正社區長照機構,臺北市,63000,中正區,63000050,臺北市中正區建國里貴陽街一段60號3樓,121.5090408,25.03892517,日間照顧服務,02-23831958,rct03702883@gmail.com,董光式,20210315 14:06:13
台北市梘尾關懷互助協會,臺北市,63000,文山區,63000080,臺北市文山區景慶里萬慶街6號,121.5402527,24.99232483,巷弄長照站,02-89351788,older.hearing@msa.hinet.net,蔡淵輝,20221229 23:11:16
財團法人一粒麥子社會福利慈善事業基金會(中正國宅社區照顧關懷據點),臺北市,63000,萬華區,63000070,臺北市萬華區新安里萬大路237巷13弄3號,121.5055847,25.02584076,巷弄長照站,02-2309-0660,liz@wheat.org.tw,呂信雄,20221229 22:15:25
粱耳鼻喉科診所,臺北市,63000,士林區,63000110,臺北市士林區社正路12-1號,121.5093002,25.08855057,居家失能個案家庭醫師照護服務,02-2816-8456,kimbo@doctorvoice.org,楊境森,20221230 21:48:30
社團法人中華民國香柏樹長者社區關懷協會,臺北市,63000,內湖區,63000100,臺北市內湖區東湖里康樂街110巷16弄20號5樓,121.6183853,25.07037354,營養餐飲服務,(02)6325560,nhsc.knjc@gmail.com,黃哲人,20210316 11:51:39
皓仁健康照護事業有限公司附設新北市私立皓仁居家式服務類長期照顧服務機構,新北市,65000,汐止區,65000110,新北市汐止區大同里大同路二段240號11樓,121.6540375,25.06548309,喘息服務,02-26480680,yenjen@haoren.com.tw,謝李麗雲,20240520 15:35:30
社團法人中華民國新生活社會福利促進會(社照C),新北市,65000,三芝區,65000210,新北市三芝區埔頭里43-1號,121.4991837,25.26161385,巷弄長照站,02-26368398,lkd0901@newlifesw.org.tw,蘇興李,20230628 16:47:23
台灣居護股份有限公司附設臺北市私立聯承居家長照機構,臺北市,63000,大安區,63000030,臺北市大安區義村里忠孝東路3段136號11樓1102辦公室,121.5377884,25.041502,居家服務,82588088,thnbuurtzorg@gmail.com,汪秋蓉,20230202 16:35:32
臺北市私立前瞻居家長照機構,臺北市,63000,文山區,63000080,臺北市文山區興昌里辛亥路4段21巷10號9樓,121.5590286,25.00873756,居家服務,02-8931-2545,h89312545@gmail.com,楊邦媛,20220104 19:12:50
忠孝事業有限公司附設臺北市私立忠孝居家長照機構,臺北市,63000,北投區,63000120,臺北市北投區榮華里明德路283號3樓,121.5221329,25.1145134,居家服務,2821-4922,zhongxiao88165821@gmail.com,陳君慧,20221229 23:01:08
社團法人中華長照協會附設臺北市私立永樂居家長照機構,臺北市,63000,文山區,63000080,臺北市文山區羅斯福路六段134號2樓,121.5442276,24.99927902,居家服務,02-2930-6919,chxclc001@gmail.com,金國良,20220324 15:19:56
社團法人中華民國新希望關懷協會(社照C),新北市,65000,林口區,65000170,新北市林口區湖南里文林六街62巷11號1樓,121.3717728,25.08177948,巷弄長照站,02-26099990,elaine945@gmail.com,楊鑫,20220503 09:06:51
臺北市私立家福居家長照機構,臺北市,63000,信義區,63000020,臺北市信義區六合里松仁路252號1樓,121.5693054,25.02443886,居家服務,87861127,joyce910524@yahoo.com.tw,張嘉真,20210407 10:27:12
台北市士林區天和社區發展協會,臺北市,63000,士林區,63000110,臺北市士林區天山里中山北路7段154巷6號4樓(天母區民活動中心),121.5329437,25.12344742,巷弄長照站,02-28772369,eva889263@yahoo.com.tw,何辰熙,20210407 11:22:23
臺北市大安區法治里辦公處,臺北市,63000,大安區,63000030,臺北市大安區法治里通化街192號,121.5529251,25.02617073,巷弄長照站,980403536,michellelin0207@yahoo.com.tw,林佩燕,20210407 11:34:46
財團法人陽明山基督教天母禮拜堂,臺北市,63000,士林區,63000110,臺北市士林區天母里中山北路7段216巷1號1樓,121.5330048,25.12586021,巷弄長照站,02-2871-1622#25,bible2312@gmail.com,王騰敏,20210407 11:36:22
士林區芝山岩社區發展協會,臺北市,63000,士林區,63000110,臺北市士林區名山里雨聲街68號(芝山岩區民活動中心),121.5287552,25.1036129,巷弄長照站,911328596,yueh2158@pchome.com.tw,廖岳,20210407 11:46:19
社團法人台灣樂活服務發展協會(樂活社子),臺北市,63000,士林區,63000110,臺北市士林區社子里延平北路6段82巷5號,121.508606,25.08907127,巷弄長照站,983108777,saxochi@gmail.com,馬瑞辰,20210407 11:53:31
台北市新生活社會福利協進會,臺北市,63000,士林區,63000110,臺北市士林區富洲里延平北路九段122號,121.4733124,25.10644531,巷弄長照站,937094689,office@tpenewlife.org,張淑貞,20210407 11:58:56
財團法人台北市聖佳蘭先開懷社會福利慈善基金會,臺北市,63000,士林區,63000110,臺北市士林區陽明里建業路73巷10 號,,,巷弄長照站,02-28614057,sylg.533@gmail.com,黃翠芳,20210407 12:00:02
社團法人中華仁親社區關懷協會(士林好厝邊),臺北市,63000,士林區,63000110,臺北市士林區義信里基河路128號(士林靈糧堂),121.5231323,25.08867645,巷弄長照站,228803408,Ericlin7028@gmail.com,劉群茂,20210407 13:36:12
臺北市士林區葫東里辦公處,臺北市,63000,士林區,63000110,臺北市士林區葫東里中正路589號1樓,121.5107269,25.08664894,巷弄長照站,0933-716-265,daisykuo@hotmail.com,郭淑玲,20210407 13:37:17
臺北市士林區福中里辦公處,臺北市,63000,士林區,63000110,臺北市士林區福中里福港街151號10樓9樓,121.5180511,25.08741951,巷弄長照站,228838207,hsiulien0317@gmail.com,王德利,20210407 13:59:04
社團法人台北市士林全人關懷協會,臺北市,63000,士林區,63000110,臺北市士林區福德里文林路421巷30號2樓&中正路335巷9號,121.5232315,25.09421158,巷弄長照站,953469293,kuoml67@yahoo.com.tw,許承道,20210407 14:05:28
臺北市士林區德行里里辦公處,臺北市,63000,士林區,63000110,臺北市士林區德行里德行西路30號1樓,121.5234833,25.10547066,巷弄長照站,0939-931-903,majasmine519@gmail.com,張僡美,20210407 14:11:15
臺北市大安區古風社區發展協會,臺北市,63000,大安區,63000030,臺北市大安區古風里師大路117巷1號  雲和街72巷9號,121.5286484,25.02223396,巷弄長照站,983293018,fanghui100@gmail.com,邱信賢,20210407 14:54:32
臺北市大安區民炤里辦公處,臺北市,63000,大安區,63000030,臺北市大安區民炤里信義路3段31巷5號1樓,121.5346146,25.03414726,巷弄長照站,02-27008406,c20181124@gmail.com,周暉泰,20210407 14:56:17
財團法人台北市中華基督教衛理公會衛理堂,臺北市,63000,大安區,63000030,臺北市大安區民輝里新生南路1段113號,121.5330582,25.03969383,巷弄長照站,02-2771-2017#141,joshua87427@gmail.com,歐陽讓,20210407 15:18:25
臺北市大安區永康里辦公處,臺北市,63000,大安區,63000030,臺北市大安區永康里金華街199巷3弄6號1樓,121.5284195,25.03056145,巷弄長照站,931234954,yongkangvillage@gmail.com,李明螢,20210407 15:19:39
臺北市大安區光明里辦公處,臺北市,63000,大安區,63000030,臺北市大安區光明里信義路2段86巷26號,121.5257874,25.03379822,巷弄長照站,0928-924384,q23914185@gmail.com,張惠銓 ,20210407 15:21:16
台北市通化玫瑰社會關懷協會,臺北市,63000,大安區,63000030,臺北市大安區法治里通化街178號,121.5532837,25.0274868,巷弄長照站,0975-227919,peteryeh2009@gmail.com,葉永誠 ,20210407 15:25:22
社團法人中華生命關愛協會,臺北市,63000,大安區,63000030,臺北市大安區芳和里和平東路3段212巷12號,121.5536728,25.02220535,巷弄長照站,922407837,chowyinhwa@gmail.com,周音華,20210407 15:34:41
臺北市大安區通安里辦公處,臺北市,63000,大安區,63000030,臺北市大安區通安里通安街98號 (臺北市通安區民活動中心),121.5529404,25.0298481,巷弄長照站,02-2703-8807,bi-garytu@mail.taipei.gov.tw,鄭文明,20210407 15:36:28
臺北市大安區大安新龍社區發展協會,臺北市,63000,大安區,63000030,臺北市大安區新龍里信義路三段134巷98號1樓,121.5389481,25.02908134,巷弄長照站,02-2706-7771,t123411@hotmail.com,李沈素勤,20210407 15:37:38
社團法人台灣德安社會福利協會受託經營管理臺北市大安老人服務中心,臺北市,63000,大安區,63000030,臺北市大安區德安里四維路76巷12號,121.547348,25.03420448,巷弄長照站,27086255,daanolder@gmail.com,陳敏雄,20210407 15:46:07
臺北市大安區錦町社區發展協會,臺北市,63000,大安區,63000030,臺北市大安區錦安里潮州街130巷3號1樓,121.5275726,25.02854347,巷弄長照站,02-2351-5967,chk550505168@gmail.com,龔志慧,20210407 15:54:08
臺北市大安區錦華里辦公處 ,臺北市,63000,大安區,63000030,臺北市大安區錦泰里羅斯福路2段35巷19弄6號1樓,121.5230103,25.02825356,巷弄長照站,02-23511711#8238,bi-s9091006@mail.taipei.gov.tw,溫美珠,20210407 15:55:11
社團法人台灣愛鄰社區服務協會(大安區),臺北市,63000,大安區,63000030,臺北市大安區龍門里和平東路二段24號11樓,121.5364761,25.02557564,巷弄長照站,02-23692674,peter.chu@breadoflife.taipe,莊碧明,20210407 16:00:11
臺北市私立好運居家長照機構,臺北市,63000,內湖區,63000100,臺北市內湖區葫洲里民權東路6段266號6樓,121.6047592,25.07164955,居家服務,02-2631-0670,haoyun26310670@gmail.com,汪新儀,20211230 18:16:13
臺北市士林區福順里辦公處,臺北市,63000,士林區,63000110,臺北市士林區福順里延平北路5段136巷24號,121.5114746,25.08218765,巷弄長照站,0958-830-605,bn_526@mail.taipei.gov.tw,林家卉,20210408 09:21:23
社團法人臺北市中山區大直社區發展協會(大直一),臺北市,63000,內湖區,63000100,臺北市內湖區寶湖里民權東路六段208號,121.5966949,25.06763649,巷弄長照站,0931-302823,bl-yuhsin@mail.taipei.gov.tw,宋羅蘭,20210408 16:09:29
財團法人台灣老人急重症基金會(聚盛據點),臺北市,63000,中山區,63000040,臺北市中山區聚盛里民生東路一段42號7樓之3,121.5418777,25.08140183,巷弄長照站,02-25224388,tfgecc@tfgecc.tw,蔡正河,20210408 16:11:54
社團法人台北市家庭照顧者關懷協會,臺北市,63000,中山區,63000040,臺北市中山區北安里北安路805巷4弄5號地下,121.5545883,25.08613396,巷弄長照站,916780645,tachih70@yahoo.com.tw,李孟芬,20210408 16:14:33
財團法人臺北市松年長春社會福利基金會(中山),臺北市,63000,中山區,63000040,臺北市中山區行仁里龍江路318巷7號1樓,121.5404205,25.06484032,巷弄長照站,02-2500-0206,pine004@twdc.org.tw,黃春生,20210408 16:23:16
臺北市中山區晴光里辦公處,臺北市,63000,中山區,63000040,臺北市中山區晴光里雙城街18巷20號,121.5230026,25.06538582,巷弄長照站,981201026,janny0918@gmail.com,林姿吟,20210408 16:27:22
臺北市復華長青多元服務中心(財團法人台灣省私立健順養護中心),臺北市,63000,中山區,63000040,臺北市中山區復華里遼寧街185巷11號,121.5427628,25.05342484,巷弄長照站,02-2717-1393#16,fuhua1060810@gmail.com,黃禎祥,20210408 16:29:06
臺北市快樂松年社,臺北市,63000,中山區,63000040,臺北市中山區新生里民權東路2段46號3樓之2,121.5300827,25.06234741,巷弄長照站,920220422,cynthia422@yahoo.com.tw,羅聯昇,20210408 16:30:30
財團法人台北市東門基督長老教會,臺北市,63000,中正區,63000050,臺北市中正區三愛里仁愛路二段76號,121.5302582,25.03802109,巷弄長照站,02-23513589,egate.tp@gmail.com,鄭愛玲,20210408 16:34:21
財團法人伽耶山基金會,臺北市,63000,中正區,63000050,臺北市中正區文北里濟南路二段36號2樓、3樓、4樓,121.5296021,25.04060936,巷弄長照站,02-2394-6800#403,twlate2014@gmail.com,陳夏珠  ,20210408 16:42:46
臺北市中正區永寬社區發展協會,臺北市,63000,中正區,63000050,臺北市中正區永昌里寧波西街181巷8號,121.5104446,25.02661133,巷弄長照站,02-23014838,4838abc@gmail.com,黃美月,20210408 16:44:46
台北市寶藏巖文化村協會,臺北市,63000,中正區,63000050,臺北市中正區水源里汀州路三段230巷14弄10號,121.5324173,25.01056671,巷弄長照站,926579112,thcca2012@gmail.com,徐聖情 ,20210408 16:46:24
臺北市中正區新永昌社區發展協會,臺北市,63000,中正區,63000050,臺北市中正區永昌里汀州路1段242巷17號,121.5098419,25.02709389,巷弄長照站,966452161,hcn630@gmail.com,許巧妮 ,20210408 16:49:35
臺北市中正區新營里辦公處,臺北市,63000,中正區,63000050,臺北市中正區新營里寧波東街16巷4號1樓,121.5207138,25.03230858,巷弄長照站,02-23214028,sophia.ja18@gmail.com,何國榮,20210408 17:27:30
臺北市中正區櫻花社區發展協會,臺北市,63000,中正區,63000050,臺北市中正區網溪里牯嶺街165號,121.5191345,25.02184105,巷弄長照站,919940027,s33651923@yahoo.com.tw,夏萬浪,20210616 18:04:03
臺北市中正區螢橋社區發展協會,臺北市,63000,中正區,63000050,臺北市中正區螢雪里福州街59號1樓,121.5143585,25.02670288,巷弄長照站,02-23052201,yijyechen@gmail.com,陳文質 ,20210408 17:31:50
台北市愛羊全人關懷協會,臺北市,63000,中正區,63000050,臺北市中正區龍光里和平西路二段17號2樓,121.5137329,25.02833176,巷弄長照站,0937-888594,keng2727@yahoo.com.tw,葉姿伶 ,20210408 17:32:48
臺北市內湖區石潭社區發展協會,臺北市,63000,內湖區,63000100,臺北市內湖區石潭里成功路二段1號2樓,,,巷弄長照站,02-27937177,shuru571110@gmail.com,廖煒國,20210408 17:41:16
財團法人中華民國台灣基督教信義會內湖教會,臺北市,63000,內湖區,63000100,臺北市內湖區港都里港墘路100巷2號1樓,121.5772171,25.08023071,巷弄長照站,02-27993958,lipkao@gmail.com,陳至敏,20210408 17:46:46
內湖區湖興里辦公處,臺北市,63000,內湖區,63000100,臺北市內湖區湖興里成功路二段320巷19號3樓,121.5899506,25.06773376,巷弄長照站,02-27914586,mor6168@gmail.com,蔡穎峰,20210408 18:05:22
內湖區寶湖里辦公處,臺北市,63000,內湖區,63000100,臺北市內湖區寶湖里民權東路六段208號,121.5966949,25.06763649,巷弄長照站,0931-302823,bl-yuhsin@mail.taipei.gov.tw,邱顯松,20210408 18:07:47
臺北市文山區木柵社區發展協會,臺北市,63000,文山區,63000080,臺北市文山區木柵里久康街92-1號,121.5671692,24.99044418,巷弄長照站,0933-220278,kh8113@gmail.com,高銘傳,20210408 18:16:32
財團法人台北市松年長春社會福利基金會(開元),臺北市,63000,文山區,63000080,"臺北市文山區木新里開元街25,27號",121.5690613,24.98909378,巷弄長照站,02-2500-0206,"pine004@twdc.org,tw",王淑惠,20210408 18:19:37
家禾認知社區關懷協會,臺北市,63000,文山區,63000080,臺北市文山區政大里政大1街3號1樓,121.5842896,24.98599434,巷弄長照站,02-2234-2467,scchaochao@gmail.com,周存林,20210409 15:16:48
臺北市文山區華興里辦公處,臺北市,63000,文山區,63000080,臺北市文山區華興里木柵路一段264號,121.554512,24.98799515,巷弄長照站,905991580,huaxing0607@gmail.com,陳峙穎,20210409 15:19:32
台北市文山區景慶社區發展協會,臺北市,63000,文山區,63000080,臺北市文山區景慶里景福街126號,121.5359573,24.99581528,巷弄長照站,02-25183311分機310,a313747@gmail.com,馬紹俊,20210409 15:21:07
台灣迦美福音傳播協會,臺北市,63000,文山區,63000080,臺北市文山區景華里三福街74巷2號1樓,121.5443573,24.99765396,巷弄長照站,02-29348952,olivetreepeng@yahoo.com.tw,朱信介,20210409 15:23:17
社團法人台灣厝邊有愛關懷協會(台北公舘),臺北市,63000,文山區,63000080,臺北市文山區萬年里汀州路四段85巷2號,121.5375748,25.00740814,巷弄長照站,02-23635546,lo1119@ms53.hinet.net,鄭忠仁,20210409 15:29:21
臺北市文山區順興里辦公處,臺北市,63000,文山區,63000080,臺北市文山區順興里興隆路4段165巷50號1樓,121.5640335,24.98427391,巷弄長照站,972246029,bs-pstchsien@mail.tapei.gov.tw,楊培釧,20210409 15:30:25
財團法人台北市活石基督徒團契,臺北市,63000,文山區,63000080,臺北市文山區萬興里指南路二段45巷24弄17號,121.5753632,24.98946381,巷弄長照站,925230295,lingling7475@yahoo.com.tw,謝長安,20210409 16:04:42
臺北市文山區興旺社區發展協會,臺北市,63000,文山區,63000080,臺北市文山區興旺里福興路27號,121.5511627,25.0028038,巷弄長照站,936048808,junghuiliao@gmail.com,陳忠榮,20210409 16:16:31
台北市北投青溪協會,臺北市,63000,北投區,63000120,臺北市北投區中庸里珠海路2號,121.5012436,25.13754082,巷弄長照站,台北市北投區中庸里珠海路2號,skyfu218@gmail.com,陳宗陽,20210409 17:18:05
臺北市北投區永和社區發展協會,臺北市,63000,北投區,63000120,臺北市北投區永和里行義路138-1號1樓,121.5279617,25.12960434,巷弄長照站,910069290,l5168@hotmail.com,陳世正,20210409 17:20:16
臺北市北投區幸福永和社區發展協會,臺北市,63000,北投區,63000120,臺北市北投區永和里行義路63號,121.5279465,25.12621307,巷弄長照站,928363298,rita354169@gmail.com,高秀蘭,20210409 17:21:16
台北市北投區新石牌社區發展協會,臺北市,63000,北投區,63000120,臺北市北投區石牌里自強街120巷15弄8號,121.5162964,25.11034393,巷弄長照站,(02)2823-6699,j19830406@gmail.com,劉世豪,20210409 17:22:21
臺北市北投區我愛石牌社區發展協會,臺北市,63000,北投區,63000120,臺北市北投區石牌里建民路116巷13 號,121.5178757,25.10984802,巷弄長照站,0928-228-369,lv228369@me.com,吳明益,20210412 10:25:49
社團法人國際奔享體驗教育發展協會(吉利真光),臺北市,63000,北投區,63000120,臺北市北投區吉利里石牌路一段39巷80弄41號1樓,121.5109406,25.11593819,巷弄長照站,02-28288884,gieeda.gieeda@gmail.com,曾美蘭,20210412 10:28:20
臺北市北投區吉慶社區發展協會,臺北市,63000,北投區,63000120,臺北市北投區吉慶里致遠二路61巷2-2號,121.5116348,25.11497498,巷弄長照站,02-2828-2002,tsung34@yahoo.com.tw,陳绣絹,20210412 10:29:23
台北市基督教新城教會,臺北市,63000,北投區,63000120,臺北市北投區東華里東華街2段180之1號,121.5110168,25.12021637,巷弄長照站,02-28236310,a0916983917@gmail.com,黎秉劼,20210412 10:49:52
財團法人台北市北投文化基金會,臺北市,63000,北投區,63000120,臺北市北投區林泉里中山路5-12號,121.5096054,25.13800621,巷弄長照站,02-28917453,smiler826@gmail.com,詹儒宗,20210412 10:51:21
台北市石牌長青會,臺北市,63000,北投區,63000120,臺北市北投區長安里中央北路1段12號3樓及4樓,121.5009995,25.13390732,巷弄長照站,911251092,skyfu218@gmail.com,白惠萍,20221230 20:44:34
台北市石牌全人關懷協會,臺北市,63000,北投區,63000120,臺北市北投區榮華里明德路283號,121.5222092,25.11500931,巷弄長照站,02-28262602*11,candykaofeeling@gmail.com,許曉元,20210412 11:13:47
臺北市松山區中正里辦公處,臺北市,63000,松山區,63000010,臺北市松山區中正里長安東路二段229號12樓,121.5458527,25.0483799,巷弄長照站,0937-031518,ruru19841224@gmail.com,洪樸陽,20210412 11:19:23
社團法人台灣厝邊有愛關懷協會（敦化）,臺北市,63000,松山區,63000010,臺北市松山區民有里敦化北路238巷7-9號,121.5487213,25.06035614,巷弄長照站,02-3635546,lo1119@ms53.hinet.net,鄭忠仁,20210412 11:25:30
台北市松山區松榮社區發展協會,臺北市,63000,松山區,63000010,臺北市松山區東榮里民生東路5段69巷3號1樓,121.558136,25.05908203,巷弄長照站,02-27676931,eliahom@gmail.com,鄭玉梅,20210412 12:00:14
臺北市松山區東勢里辦公處,臺北市,63000,松山區,63000010,臺北市松山區東勢里南京東路4段133巷8弄17號,121.5543442,25.05303764,巷弄長照站,02-27170369,bh_ssda207@mail.taipei.gov.tw,王叔珍,20210412 12:01:15
財團法人台北市林坤地仁濟文教基金會,臺北市,63000,松山區,63000010,臺北市松山區美仁里八德路3段25號藝文推廣處二樓電化教室,121.5520172,25.04835129,巷弄長照站,02-2751-5790,tkyang03@gmail.com,楊杜清香,20210412 13:47:41
社團法人愛樂福關懷文創發展協會,臺北市,63000,松山區,63000010,臺北市松山區莊敬里撫遠街367巷4號,121.5661087,25.06380081,巷弄長照站,926623482,tyy59792000@gmail.com,王澤民,20210412 13:49:09
松山區建源社區發展協會,臺北市,63000,松山區,63000010,臺北市松山區復建里八德路3段158巷7弄20號(復建區民活動中心),121.5560532,25.04736328,巷弄長照站,02-25791689,shiohow@yahoo.com.tw,陳秀華,20210412 13:50:10
財團法人台北市私立永年社會福利慈善基金會,臺北市,63000,松山區,63000010,臺北市松山區復勢里光復北路80巷1號1樓,,,巷弄長照站,02-2578-6677#2232,socialwork@pojengh.com.tw,王建哲,20210412 13:51:26
財團法人雙福社會福利慈善事業基金會(蒙恩),臺北市,63000,松山區,63000010,臺北市松山區復勢里光復北路112號8樓,121.5577087,25.05070877,巷弄長照站,02-2392-2993分機12,asiapd@gmail.com,吳英賓,20210412 13:52:23
臺北市松山區龍田里辦公處,臺北市,63000,松山區,63000010,臺北市松山區龍田里光復北路230巷21號B1,121.5545654,25.0559845,巷弄長照站,988179571,bh_ssda207@mail.taipei.gov.tw,袁俊麒,20210412 14:06:32
財團法人台灣省私立健順養護中心(松山老人服務暨日間照顧中心),臺北市,63000,松山區,63000010,臺北市松山區鵬程里健康路317號1樓,121.5666122,25.05446815,巷弄長照站,02-2768-5636,sselder105@gmail.com,黃禎祥,20210412 14:09:05
臺北市松山區慈祐里辦公處,臺北市,63000,松山區,63000010,臺北市松山區慈祐里八德路4段580號1樓,121.5717392,25.0497036,巷弄長照站,938889576,casper255058@gmail.com,李祖民 ,20210412 14:10:27
財團法人台北市基督教全人福利事業基金會(吳興教會),臺北市,63000,信義區,63000020,臺北市信義區三張里吳興街269巷18弄6號,121.5647736,25.02709579,巷弄長照站,02-2758-9796,joan0801@ms68.hinet.net,鍾梅香,20210412 14:13:36
