機構名稱,縣市,縣市代碼,行政區,行政區代碼,地址全址,經度,緯度,特約服務項目,機構電話,電子郵件,機構負責人姓名,最後異動時間
新北市私立共笙居家長照機構,新北市,65000,三重區,65000020,新北市三重區重新路二段21號8樓(803室),121.4980392,25.06240845,居家服務,986670831,gsjjcz999@gmail.com,賴盈如,20230310 13:59:43
新北市私立共笙居家長照機構,新北市,65000,三重區,65000020,新北市三重區重新路二段21號8樓(803室),121.4980392,25.06240845,喘息服務,986670831,gsjjcz999@gmail.com,賴盈如,20230310 14:00:49
社團法人台灣喜樂家族協會附設臺北市私立冠冕居家長照機構,臺北市,63000,士林區,63000110,臺北市士林區雙溪街140號1樓,121.5243759,25.10041046,居家服務,02-2832-0533,crown.homelife@gmail.com,林黃寶彩,20230310 17:18:27
小藥師健保藥局,臺北市,63000,南港區,63000090,臺北市南港區百福里福德街320之1號1樓,121.5879822,25.03948212,輔具及居家無障礙環境服務,02-27867002,a0227867002@gmail.com,江芝瑩,20230313 11:45:38
新北市私立吉家居家長照機構,新北市,65000,板橋區,65000010,新北市板橋區四維路291巷4弄12號1樓,121.4623642,25.02852821,居家服務,02-2258-3776,jijia.hc@gmail.com,陳安宇,20230313 16:55:15
新北市私立吉家居家長照機構,新北市,65000,板橋區,65000010,新北市板橋區四維路291巷4弄12號1樓,121.4623642,25.02852821,喘息服務,02-2258-3776,jijia.hc@gmail.com,陳安宇,20230313 16:55:42
新北市愛笑瑜伽協會(奕壽站)(社照C),新北市,65000,三重區,65000020,新北市三重區奕壽里新北市三重區介壽路26號,121.4882126,25.06318474,巷弄長照站,(02)8988-3840,smile.yoga.xindei2017@Gmail.com,王淑芳,20230316 11:05:27
新北市中和區莒東社區發展協會(社照C),新北市,65000,中和區,65000030,新北市中和區民有里民享街37號2樓,121.4741287,25.00357246,巷弄長照站,953479779,sel3934@gmail.com,吳育舟,20230316 11:14:14
中化銀髮事業股份有限公司附設臺北市私立暖時光社區長照機構,臺北市,63000,中山區,63000040,臺北市中山區長安東路二段131-1號1-3樓及131-2號2-3樓,121.5361633,25.04850578,日間照顧服務,978511719,kate.chang@ccpc.com.tw,王謝怡貞,20240104 16:13:05
社團法人中華兩岸養老產業發展協會附設新北市私立板橋海山社區長照機構,新北市,65000,板橋區,65000010,新北市板橋區深丘里長安街253號1樓及2樓,121.4727859,25.01021385,喘息服務,02-89520151,haishan201410@gmail.com,黃明發,20230320 10:34:57
優活健康顧問有限公司附設臺北市私立優活居家長照機構,臺北市,63000,文山區,63000080,臺北市文山區景福街133巷30號1樓,121.5733566,24.98967552,居家服務,02-2933-6682,cynthia5434@gmail.com,林亭如,20230322 10:02:31
瑞和診所,新北市,65000,深坑區,65000180,新北市深坑區北深路三段99號6樓,121.6057968,25.00166702,居家失能個案家庭醫師照護服務,02-2662-3302,juihoclinic@gmail.com,洪瑞苑,20230322 14:13:35
臺北市政府社會局委託財團法人台北市立心慈善基金會經營管理臺北市萬華龍山社區長照機構,臺北市,63000,萬華區,63000070,臺北市萬華區青山里梧州街36號3樓之1,121.4974899,25.03737259,營養餐飲服務,02-23361881,longshanold@gmail.com,洪金桐,20230325 16:57:36
暉宇有限公司附設臺北市私立星雲祥家社區長照機構,臺北市,63000,內湖區,63000100,臺北市內湖區清白里星雲街161巷3號3樓,121.5966034,25.08118629,喘息服務,(02)2790-0898,Huiyu20201208@gmail.com,楊雋宇,20230330 11:17:52
新北市平溪區南山社區發展協會(社照C),新北市,65000,平溪區,65000240,新北市平溪區南山里靜安路三段232號,121.7762756,25.0394001,巷弄長照站,2495-1510,wendy70612@gmail.com,劉清榮,20230328 16:02:28
臺北市政府衛生局委託臺北榮民總醫院經營管理稻香社區長照機構,臺北市,63000,北投區,63000120,臺北市北投區稻香路81號4樓,121.4892883,25.14091301,日間照顧服務,02-28958575,daoxiangfacility@gmail.com,陳威明,20230330 09:09:24
康和文山樂活股份有限公司附設臺北市私立杏花學塾社區長照機構,臺北市,63000,文山區,63000080,臺北市文山區辛亥路4段128-1號2樓,121.5566864,25.00517845,喘息服務,29356802,wsflower128@gmail.com,蔡淑芬,20230330 11:17:17
善誠健康事業股份有限公司附設新北市私立林口善誠社區長照機構,新北市,65000,林口區,65000170,新北市林口區湖南里文化三路二段298號1樓,121.3771667,25.08349991,日間照顧服務,86019640,Alicia.hung@medtecs.com,林仁德,20230406 09:26:14
善誠健康事業股份有限公司附設新北市私立林口善誠社區長照機構,新北市,65000,林口區,65000170,新北市林口區湖南里文化三路二段298號1樓,121.3771667,25.08349991,喘息服務,86019640,Alicia.hung@medtecs.com,林仁德,20230406 09:26:44
(新北)社團法人中華慈雲慈善利生推廣協會,臺北市,63000,士林區,63000110,臺北市士林區平菁街95巷47之2號,121.5819702,25.13575745,喘息服務,02-86851138,fayu991010@gmail.com,陳永涸,20230406 09:32:45
新北市板橋莒光天上聖母會,新北市,65000,板橋區,65000010,新北市板橋區莒光里文化路二段124巷8號,121.4705582,25.0259037,巷弄長照站,932947902,k0932947902@gmail.com,戴圭柱,20240531 21:23:32
新北市私立許量居家長照機構,新北市,65000,淡水區,65000100,新北市淡水區北新路182巷41弄4號5樓,121.4483109,25.17737007,居家服務,906805906,twzara@gmail.com,廖月伶,20230407 10:21:50
新北市私立許量居家長照機構,新北市,65000,淡水區,65000100,新北市淡水區北新路182巷41弄4號5樓,121.4483109,25.17737007,喘息服務,906805906,twzara@gmail.com,廖月伶,20230407 10:22:31
社團法人台灣幸扶公益協會附設新北市私立汐止社區長照機構,新北市,65000,汐止區,65000110,新北市汐止區新昌里新台五路二段81號,121.6641617,25.06684875,喘息服務,(02)26919122,chefon23@gmail.com,鄭正,20230414 14:15:32
家佳健康股份有限公司附設新北市私立品綸居家長照機構,新北市,65000,蘆洲區,65000140,新北市蘆洲區集賢路209號4樓,121.4834442,25.08714676,居家服務,8286-1811,pinlun213@hotmail.com.tw,朱瑜慈,20230417 10:06:04
家佳健康股份有限公司附設新北市私立品綸居家長照機構,新北市,65000,蘆洲區,65000140,新北市蘆洲區集賢路209號4樓,121.4834442,25.08714676,喘息服務,8286-1811,pinlun213@hotmail.com.tw,朱瑜慈,20230417 10:06:38
優福國際股份有限公司附設臺北市私立優福居家長照機構,臺北市,63000,大同區,63000060,臺北市大同區延平北路三段4號5樓(521室),121.5115738,25.06377029,喘息服務,0976-804-827,ufo90367886@gmail.com,李盛豊,20230509 16:49:58
潤田健康有限公司附設臺北市私立潤田居家長照機構,臺北市,63000,中正區,63000050,臺北市中正區龍福里湖口街1之3號1樓,121.5150299,25.03277588,喘息服務,02-23435882,runtian0510@gmail.com,江錦珍,20230417 10:46:17
詠林長照社團法人附設新北市私立詠林綜合長照機構,新北市,65000,淡水區,65000100,新北市淡水區竿蓁里中正東路一段111巷20號1至6樓,121.4551239,25.16087723,日間照顧服務,905692910,a26260766@yahoo.com.tw,黃晟恆,20230420 09:18:00
詠林長照社團法人附設新北市私立詠林綜合長照機構,新北市,65000,淡水區,65000100,新北市淡水區竿蓁里中正東路一段111巷20號1至6樓,121.4551239,25.16087723,喘息服務,905692910,a26260766@yahoo.com.tw,黃晟恆,20230420 09:18:33
玖龍國際有限公司,新北市,65000,汐止區,65000110,新北市汐止區新台五路一段188號4樓之1,121.6550369,25.06263924,交通接送服務,02-26382119,jiesen3536@gmail.com,江薏如,20230420 14:30:39
社團法人台灣喜樂家族協會附設臺北市私立冠冕居家長照機構,臺北市,63000,士林區,63000110,臺北市士林區雙溪街140號1樓,121.5243759,25.10041046,喘息服務,02-2832-0533,crown.homelife@gmail.com,林黃寶彩,20230421 09:30:11
中華民國體育運動教練協會(社照C),新北市,65000,三峽區,65000090,新北市三峽區鳶山里大勇路18之2號3樓、18之3號3樓,121.3669281,24.93797493,巷弄長照站,910315119,A098619867245@gmail.com,許美榛,20230526 11:12:43
互照有限公司附設新北市私立春天居家長照機構,新北市,65000,板橋區,65000010,新北市板橋區縣民大道一段271號4樓,121.46035,25.00991821,居家服務,0926-920-597,weilinghoho0721@gmail.com,吳坤裕,20230425 10:53:06
互照有限公司附設新北市私立春天居家長照機構,新北市,65000,板橋區,65000010,新北市板橋區縣民大道一段271號4樓,121.46035,25.00991821,喘息服務,0926-920-597,weilinghoho0721@gmail.com,吳坤裕,20230425 10:53:29
新北市私立恩勤居家長照機構,新北市,65000,板橋區,65000010,新北市板橋區文化路一段189號7樓,121.4630585,25.01655579,個案管理服務,8953-5988,kelly2266@kimo.com,陳蕙汎,20230425 13:42:19
財團法人台北市私立愛愛院,臺北市,63000,萬華區,63000070,臺北市萬華區大理街175巷27號,121.4955292,25.03455925,個案管理服務,02-23060493,csp1@aiai.org.tw,施武靖,20230425 16:55:21
樂福健康事業有限公司附設臺北市私立樂福居家長照機構,臺北市,63000,大同區,63000060,臺北市大同區永樂里西寧北路81號5樓之2,121.5088577,25.05611038,個案管理服務,225598079,lovefu0514@gmail.com,吳海銘,20230425 17:04:30
樂福健康事業有限公司附設臺北市私立樂福居家長照機構,臺北市,63000,大同區,63000060,臺北市大同區永樂里西寧北路81號5樓之2,121.5088577,25.05611038,個案管理服務,225598079,lovefu0514@gmail.com,吳海銘,20230425 17:04:50
愛志股份有限公司附設臺北市私立愛志居家長照機構,臺北市,63000,南港區,63000090,臺北市南港區東新里重陽路120號3樓309室,121.5994797,25.05654907,個案管理服務,02-27882211,service@earth-want.com.tw,森山典明,20230425 17:08:37
沃恩有限公司附設新北市私立耆樂居家長照機構,新北市,65000,汐止區,65000110,新北市汐止區復興里新台五路一段79號7樓B室,121.645874,25.06172752,個案管理服務,02-86983877,w86983877@gmail.com,林顯寬,20230425 17:21:52
財團法人天下為公社會福利慈善事業基金會,臺北市,63000,士林區,63000110,臺北市士林區承德路4段306號9樓,121.518631,25.08965492,個案管理服務,02-28881056,kcw@mail.oit.edu.tw,胡世賢,20230425 17:16:37
財團法人伊甸社會福利基金會,臺北市,63000,文山區,63000080,臺北市文山區萬芳里萬美街一段55號3樓,121.5681152,25.00234222,個案管理服務,02-22307715,eden8378@eden.org.tw,羅紀琼,20230425 17:18:42
財團法人台灣省私立健順養護中心,新北市,65000,深坑區,65000180,新北市深坑區昇高里王軍寮9號,121.6163025,24.9824543,個案管理服務,26622499,d6622499@ms26.hinet.net,黃禎祥,20230425 17:21:38
嘉陞健康事業股份有限公司附設臺北市私立嘉陞居家長照機構,臺北市,63000,大同區,63000060,臺北市大同區民權西路136號15樓之3,121.5123138,25.06451035,居家服務,0921-148107,goodcare0001@gmail.com,黃海同,20230426 18:14:20
凱風長照股份有限公司附設臺北市私立凱風新生北綜合長照機構,臺北市,63000,中山區,63000040,臺北市中山區晴光里新生北路三段56巷17號1樓,121.5269241,25.0657196,喘息服務,2599-6681,service@kfcare.com.tw,郭家展,20230427 09:43:47
清山交通有限公司,臺北市,63000,松山區,63000010,臺北市松山區八德路四段678號7樓之7,121.576416,25.04987144,交通接送服務,02-27457715,cingshan28@gmail.com,林青駿,20230428 12:04:17
新北市私立馨中居家長照機構,新北市,65000,鶯歌區,65000080,新北市鶯歌區信義街54號1樓,121.3532486,24.95517731,居家服務,902389689,a86862039@gmail.com, 陳彥璁,20231220 14:15:00
新北市私立馨中居家長照機構,新北市,65000,鶯歌區,65000080,新北市鶯歌區信義街54號1樓,121.3532486,24.95517731,喘息服務,902389689,a86862039@gmail.com, 陳彥璁,20231220 14:15:10
振興醫療財團法人附設振興居家護理所,臺北市,63000,北投區,63000120,臺北市北投區榮華里振興街45號,121.5224686,25.11751175,專業照護服務,02-28264400,ch7727@chgh.org.tw,李怡慧,20230501 09:29:05
稻香居家護理所(委託臺北榮民總醫院經營管理),臺北市,63000,北投區,63000120,臺北市北投區稻香路81號,121.4892883,25.14091301,專業照護服務,02-2895-6015,ccli2@vghtpe.gov.tw,李淑娟,20230502 09:20:36
福鷺社會企業有限公司附設新北市私立三重福鷺社區長照機構,新北市,65000,三重區,65000020,新北市三重區正義北路195號4樓、4樓之1,121.4962616,25.06820869,日間照顧服務,2988-0501,fuluseltc@gmail.com,張凱智,20230502 10:47:26
福鷺社會企業有限公司附設新北市私立三重福鷺社區長照機構,新北市,65000,三重區,65000020,新北市三重區正義北路195號4樓、4樓之1,121.4962616,25.06820869,喘息服務,2988-0501,fuluseltc@gmail.com,張凱智,20230502 10:47:56
邦鄰居家服務有限公司附設新北市私立邦鄰居家長照機構,新北市,65000,中和區,65000030,新北市中和區健康路89號3樓,121.4879379,25.00024223,居家服務,8228-1850,banglin808080@gmail.com,吳銀蓮,20230502 10:54:47
邦鄰居家服務有限公司附設新北市私立邦鄰居家長照機構,新北市,65000,中和區,65000030,新北市中和區健康路89號3樓,121.4879379,25.00024223,喘息服務,8228-1850,banglin808080@gmail.com,吳銀蓮,20230502 10:55:21
築燭有限公司附設新北市私立心地居家長照機構,新北市,65000,中和區,65000030,新北市中和區健康路89號3樓11室,121.4879379,25.00024223,居家服務,7752-2588,ouyang8574@gmail.com,游寶蓮,20230502 10:59:42
築燭有限公司附設新北市私立心地居家長照機構,新北市,65000,中和區,65000030,新北市中和區健康路89號3樓11室,121.4879379,25.00024223,喘息服務,7752-2588,ouyang8574@gmail.com,游寶蓮,20230502 11:00:15
新北市私立旺福居家長照機構,新北市,65000,三重區,65000020,新北市三重區溪美里福隆路48號1樓,121.4924774,25.07857895,個案管理服務,02-28571526,wfservice2@gmail.com,黃雅萍,20230503 11:51:47
財團法人天主教失智老人社會福利基金會,臺北市,63000,萬華區,63000070,臺北市萬華區德昌街125巷11號,121.496933,25.02363968,個案管理服務,02-23096500,a23096500@gmail.com,鍾安住,20230504 18:26:02
新北市私立惠眾居家長照機構,新北市,65000,淡水區,65000100,新北市淡水區民權路111號3樓C06室,121.4602737,25.13747978,居家服務,28085212,huizhong2023@gmail.com,陳愉芳,20230508 09:18:49
新北市私立惠眾居家長照機構,新北市,65000,淡水區,65000100,新北市淡水區民權路111號3樓C06室,121.4602737,25.13747978,喘息服務,28085212,huizhong2023@gmail.com,陳愉芳,20230508 09:19:23
天使居長照財團法人附設新北市私立天使居居家長照機構,新北市,65000,林口區,65000170,新北市林口區東勢里文化一路一段150之2號,121.3787766,25.07203293,居家服務,26006088,machun786@gmail.com,王建煊,20230508 09:30:28
天使居長照財團法人附設新北市私立天使居居家長照機構,新北市,65000,林口區,65000170,新北市林口區東勢里文化一路一段150之2號,121.3787766,25.07203293,喘息服務,26006088,machun786@gmail.com,王建煊,20230508 09:30:57
臺北市私立上美老人長期照顧中心(養護型),臺北市,63000,士林區,63000110,臺北市士林區重慶北路四段162號,121.51194,25.08454323,喘息服務,02-28122366,yilien3@hotmail.com,李依蓮,20230508 14:22:22
潤田健康有限公司附設臺北市私立潤田居家長照機構,臺北市,63000,中正區,63000050,臺北市中正區龍福里湖口街1之3號1樓,121.5150299,25.03277588,居家服務,02-23435882,runtian0510@gmail.com,江錦珍,20230509 09:26:08
優福國際股份有限公司附設臺北市私立優福居家長照機構,臺北市,63000,大同區,63000060,臺北市大同區延平北路三段4號5樓(521室),121.5115738,25.06377029,居家服務,0976-804-827,ufo90367886@gmail.com,李盛豊,20230509 16:49:58
煦橙股份有限公司附設新北市私立新店煦橙綜合長照機構,新北市,65000,新店區,65000060,新北市新店區廣明里光明街98之1號4樓,121.5391159,24.96037483,居家服務,(02)8919-3656,morange3656@gmail.com,蔡雅伶,20230510 11:04:54
煦橙股份有限公司附設新北市私立新店煦橙綜合長照機構,新北市,65000,新店區,65000060,新北市新店區廣明里光明街98之1號4樓,121.5391159,24.96037483,喘息服務,(02)8919-3656,morange3656@gmail.com,蔡雅伶,20230510 11:05:23
煦橙股份有限公司附設新北市私立新店煦橙綜合長照機構,新北市,65000,新店區,65000060,新北市新店區廣明里光明街98之1號4樓,121.5391159,24.96037483,日間照顧服務,(02)8919-3656,morange3656@gmail.com,蔡雅伶,20230510 11:07:01
寶安健康有限公司附設臺北市私立鑫安居家長照機構,臺北市,63000,文山區,63000080,臺北市文山區興隆路三段206巷10弄1號,121.5578918,24.9965229,居家服務,02-2230-3056,baoan206101@gmail.com,廖麗如,20230510 12:02:53
臺北市中山區朱厝崙社區發展協會,臺北市,63000,中山區,63000040,臺北市中山區朱崙里龍江路15號3樓,121.5404968,25.04743576,喘息服務,2781-5504,teak4747@yahoo.com.tw,高銘鴻,20230510 13:47:17
辰逸有限公司附設臺北市私立辰逸居家長照機構,臺北市,63000,中山區,63000040,臺北市中山區中央里南京東路2段137號14樓(109室),121.5351105,25.05221558,喘息服務,02-7755-3620,cypmc00@gmail.com,王超凡,20230512 09:21:04
財團法人天主教失智老人社會福利基金會受託經營管理本市萬華老人服務中心,臺北市,63000,萬華區,63000070,臺北市萬華區西寧南路4號A棟3樓,121.5070419,25.04793167,營養餐飲服務,2361-0666,who.cfad@gmail.com,鍾安住,20230512 17:12:30
財團法人私立健順養護中心受託經營管理本市南港老人服務中心,臺北市,63000,南港區,63000090,臺北市南港區重陽路187巷5號1、2樓,121.5987015,25.057724,營養餐飲服務,26535311,nkelder@gmail.com,黃禎祥,20230512 17:14:42
吉雅健康股份有限公司附設新北市私立樂心居家長照機構,新北市,65000,永和區,65000040,新北市永和區福和路159號3樓,121.520401,25.00762367,居家服務,2922-1368,lyne.chiu@gmail.com,邱琳婷,20230515 10:58:52
吉雅健康股份有限公司附設新北市私立樂心居家長照機構,新北市,65000,永和區,65000040,新北市永和區福和路159號3樓,121.520401,25.00762367,喘息服務,2922-1368,lyne.chiu@gmail.com,邱琳婷,20230515 10:59:31
新北市平溪區老人會(社照C),新北市,65000,平溪區,65000240,新北市平溪區嶺腳里靜安路二段531號,121.7474365,25.02809525,巷弄長照站,24952328,pojongl@gmail.com,楊明仁,20230530 16:55:49
臺北市私立祝福居家長照機構,臺北市,63000,中正區,63000050,臺北市中正區水源里羅斯福路4段68號7樓之10（6810-E室）,121.5342712,25.01450348,喘息服務,02-29321396,nikey303@gmail.com,鄭如杏,20230519 17:38:13
臺北市私立祝福居家長照機構,臺北市,63000,中正區,63000050,臺北市中正區水源里羅斯福路4段68號7樓之10（6810-E室）,121.5342712,25.01450348,專業照護服務,02-29321396,nikey303@gmail.com,鄭如杏,20230519 17:38:49
新北市私立瑞昇老人長期照顧中心(養護型),新北市,65000,板橋區,65000010,新北市板橋區四川路2段16巷1號1樓,121.4559174,24.99645805,交通接送服務,89675498,tsenglt123@hotmail.com,曾巫秀琴,20230522 10:02:34
丁大元診所,臺北市,63000,內湖區,63000100,臺北市內湖區東湖路119巷49弄4號,121.6171341,25.06990433,居家失能個案家庭醫師照護服務,02-26331010,dauyuan@hotmail.com,丁大元,20230524 11:40:20
惠安護康科技有限公司附設臺北市私立惠安居家長照機構,臺北市,63000,文山區,63000080,臺北市文山區興隆路2段86巷2號1樓,121.5484314,24.99981117,喘息服務,0952-654002,vicky6575@gmail.com,詹益發,20230525 10:48:07
知恩長期照護有限公司附設新北市私立知恩居家長照機構,新北市,65000,板橋區,65000010,新北市板橋區中山路一段1號13樓之26(A06),121.4593735,25.00741577,居家服務,0980-427-952,ases50424@gmail.com,吳詩婕,20240102 10:57:12
知恩長期照護有限公司附設新北市私立知恩居家長照機構,新北市,65000,板橋區,65000010,新北市板橋區中山路一段1號13樓之26(A06),121.4593735,25.00741577,喘息服務,0980-427-952,ases50424@gmail.com,吳詩婕,20230526 08:34:07
台灣福祉車租賃有限公司,新北市,65000,新莊區,65000050,新北市新莊區新泰路502巷6號2樓,121.4427643,25.04631233,交通接送服務,02-77515349,pomelo93@gmail.com,林垂穎,20230529 23:27:09
北台灣無障礙運輸產業工會,新北市,65000,中和區,65000030,新北市中和區連勝街159號5樓,121.4942245,24.99655533,交通接送服務,02-77515349,mick9319@yahoo.com.tw,林垂穎,20230529 23:36:33
新北市三重區永安里辦公處(社照C),新北市,65000,三重區,65000020,新北市三重區永安里力行路二段63巷7號,121.4826965,25.07487106,巷弄長照站,(02)2287-0112,bow1013ha@Gmail.com,黃麗伃,20230530 19:02:38
新北市樂來越愛你關懷協會(社照C),新北市,65000,三重區,65000020,新北市三重區重新里正義北路16巷26號,121.4967346,25.06282234,巷弄長照站,02-2985-9370,a0922213490@gmail.com,李榮欽,20230530 19:14:26
財團法人北部台灣基督長老教會(三重埔教會)(社照C),新北市,65000,三重區,65000020,新北市三重區中央里自強路一段65號4樓,121.4976349,25.06718636,巷弄長照站,02-2971-0508,joy810507@gmail.com.tw,林榮任,20230530 19:19:00
新北市三重區厚德里辦公處(社照C),新北市,65000,三重區,65000020,新北市三重區厚德里三和路三段170巷49號,121.4908371,25.07267952,巷弄長照站,02-29822008,j6rmp4u4571@gmail.com,陳榮楠,20230530 19:28:00
新北市永和區永樂里辦公處(社照C),新北市,65000,永和區,65000040,新北市永和區永樂里永和路1段18巷8號1樓,121.5133591,25.00437927,巷弄長照站,989641423,shiou0408@gmail.com,許政鎧,20230530 20:27:17
社團法人中華長照協會(社照C),新北市,65000,永和區,65000040,新北市永和區文化里文化路155號,121.5104141,25.01625443,巷弄長照站,229212212,chxclc002@gmail.com,金國良,20230530 20:55:04
新北市永和區中興里辦公處(社照C),新北市,65000,永和區,65000040,新北市永和區中興里復興街88號1樓,121.5172958,25.01362991,巷弄長照站,02-29266550,j6rmp4u4571@gmail.com,林東誼,20230530 21:19:51
新北市樹林區東昇里辦公處(社照C),新北市,65000,樹林區,65000070,新北市樹林區東昇里3鄰中山路二段78-1號1樓(巡守隊辦公室),121.4153061,24.98406792,巷弄長照站,(02)8685-6377,Power0922988383@gmail.com,詹麒叡,20230531 10:42:40
社團法人中華長照協會附設新北市私立永樂居家式服務類長期照顧服務機構,新北市,65000,永和區,65000040,新北市永和區文化里文化路155號,121.5028076,25.06678772,專業照護服務,02-29280005,chxclc002@gmail.com,金浩鑫,20230531 15:33:12
新北市三重區錦通里辦公處(社照C),新北市,65000,三重區,65000020,新北市三重區錦通里中央北路26號4樓,121.5008011,25.06432343,巷弄長照站,986133181,wynner05145846@gmail.com,林煒財,20230531 16:47:40
新北市三重區開元里辦公處(社照C),新北市,65000,三重區,65000020,新北市三重區開元里開元街1號,121.5035477,25.06657982,巷弄長照站,29745949,j6rmp4u4571@gmail.com,潘素珍,20230531 16:52:48
中華璟濰長照發展協會(社照C),新北市,65000,中和區,65000030,新北市中和區安順里安平路40號,121.5101089,24.99526787,巷弄長照站,02-82458585,cwcare2019@gmail.com,王瑀潔,20230531 16:57:16
新北市中和區福美里辦公處(社照C),新北市,65000,中和區,65000030,新北市中和區福美里勝利路35巷9弄4號1樓,121.4995575,25.00699234,巷弄長照站,933566024,devin31@gmail.com,梁迪文,20230531 17:02:25
新北市疼厝邊關懷協會(社照C),新北市,65000,新莊區,65000050,新北市新莊區興漢里武前街27號,121.4503555,25.03274345,巷弄長照站,29928506,sjpct.mail@msa.hinet.net,柯賢仁,20230531 19:10:26
新北市永和區福林里辦公處(社照C),新北市,65000,永和區,65000040,新北市永和區福林里福和路122號1樓,121.5218582,25.00811958,巷弄長照站,974313443,q82956771@gmail.com,孫協同,20230531 20:26:46
新北市永和區店街里辦公處(社照C),新北市,65000,永和區,65000040,新北市永和區店街里中正路465巷18號,121.5164185,25.00600624,巷弄長照站,02-2920-7089,wanghsinjen@gmail.com,王訢人,20230531 20:32:29
新北市永和區和平里辦公處(社照C),新北市,65000,永和區,65000040,新北市永和區和平里保平路236巷12弄7號,121.508728,25.00664711,巷弄長照站,02-2927-2429,AB2396@ms.ntpc.gov.tw,柳舒雲,20230531 20:56:31
益巨股份有限公司附設臺北市私立崇仁社區長照機構,臺北市,63000,萬華區,63000070,臺北市萬華區青年路152巷28號1樓,121.5012207,25.02062416,喘息服務,23090193,dc.chongren@rghealth.com.tw,陳威男,20230601 10:25:10
幼恩診所,新北市,65000,深坑區,65000180,新北市深坑區北深路三段173號,121.6017151,25.00349426,居家失能個案家庭醫師照護服務,02-26625951,ho_yhs@yahoo.com.tw,何延祥,20230602 08:24:56
